created_utc,text
2022-03-25 00:36:15,feel like cannot something perfectly try rationally know never perfect waste time try fear messing way unbearable stopped trying connect friend isolated everyone except family boyfriend talk work lot even though social atmosphere used fun carefree worry every tiny detail speak feel like forcing never say exact “right thing” always end embarrassing always like know get back real self thing gone downhill quickly last year lost almost everyone care due self sabotage cannot truly open main issue besides plagued really scary intense existential thought time sad bored thought rise surface want die feeling scary feel alone anyone advice good video topic heal depression make lose sight isolate everyone always say “just think it” “feelings pass” whatever year want really better tried many different therapist prescription coping skill journaling hobby even distraction wondering anyone understands feel really alone know else turn thank reading
2019-07-08 00:44:05,realized yesterday think taken med least week started wondering suddenly felt like x depressed month super forgetful break habit day take week month start automatically really start taking fix everything make easier feel pointless right like feel le depressed least force eat shower act like person cannot really see reason start even know posting guess want something tell get shit together take pill semblance human connection maybe screaming internet feel anxious dissociated right wanted type thought see anyone advice comfort something
2020-03-26 16:13:15,embrace trauma
2020-12-14 11:35:55,deep hole right since feb year month strong desire dead
2021-02-23 17:47:28,around kind time late middle schoolearly highschool diagnosed add depression course second got diagnosed get older getting ready college feel like symptom worsened past couple year gone several depressive state lasted month time ended suicidal hate affect mental health issue loved one honestly find certain level comfortability depressed love alone isolating medical professional would probably say since remember grown accept brain way course going purposely set failurebut hard worst part isolating made lose majority friend definitely taking toll relationship feel guilty way genuinely cannot help
2022-02-12 20:03:50,depression year taken around pill throughout life try get better seen psychologist tried sport tried reading still depressed tell starting another major depressive episode tired want anymore logical try km know work tried ask parent therapy maybe work time want pay still student way pay either know want die even hope get better feel bad nauseous
2020-03-04 21:42:40,funny actually fighting hard kill tonight edit fine good cry cut proud even though thing stopped could find knife want use someone else’s contamination anyway yeah alright thanks everyone reached wanted reach lt
2019-09-30 13:33:10,mother nature sad gave everything destroyed gave birth killed sorry mother nature made sad
2021-05-06 19:08:52,“come weary burdened give rest take yoke upon learn gentle humble heart find rest soul yoke easy burden light” jesus christ help
