created_utc,text
2021-05-01 06:11:24,know turn help year old dad showing sign depression last month sleep day night barely eats drink refuse engage activity friend family lost much weight weak exhausted say cannot even stand walk around feel dizzy weak tired barely eat bite crawl right back bed tried xanax week two moved onto zoloft started lost pound last month keep saying blockage cannot eat bite go doctor test result come back normal pcp prescribed megace steroid help gain weight working still eating lot top barely showering also constipation went without shower almost month mom forced shower finally yesterday took physical struggle get able bowel movement week month pcp saw week ago see another month recommended ensure said much biggest obstacle dad refuse seek mental help mom dad another country believe therapy extremely traditional refuse seek psychiatric help mom going crazy stress fighting pleading dad every single day bathe eat drink take enema seek psychiatric evaluation refuse everything painful depressing see dad slowly waste away called different mental health facility town say thing person need actively suicidal homicidal put involuntary lockdown inpatient treatment family know anyone offer solid advice please help sure many senior citizen suffering mental health issue especially due pandemic dad obviously stuck downward spiral please please help get better thank advance help give
2019-02-08 06:16:05,need someone talk please
2021-06-10 19:57:05,one depression girlfriend found repeat class thinking suicide talking need help would really appreciate advice thing say make feel better even telling would want person say help feel better would help point desperate kind advice help thank time
2022-07-23 03:05:49,feeling lonely depressed fell though people want take advantage meyou ghost everything broken broken close giving ffff want friend also smart good conversing help lot haaa ask keep trying tired failing feeling like loser good luck everyone
2019-12-07 09:06:43,okyoure depressed feel pain hard manage going volunteer case make difference many people cannot feel something different still thing
2021-12-31 08:00:38,feel like shit time honestly feel like life meaningless nothing working make feel understand people say much care got bright future typical thing people say someone upset make feel better like go one ear found person lift mood
2019-09-09 18:16:32,almost one year free cutting feel like life fell apart past two day currently unemployed parent keep guilttripping found power bill due day get final paycheck last job going late doubt ill money left payment textbook declined probably going book semester top phone broke last night point basically unusable money get new one called parent kept going stretched thin barely pay bill already pretty low anyway making worse honestly want sleep wake deal anymore rationally know small stuff fixed rational part brain seems vacation today want cut know fucked selfish affect friend family also know going take one emotional snap ill back cutting
2020-09-08 05:43:31,made new account one know see remember like want thing wanted travel family successful career thing grieve feeling desire anything right want nothing thing keeping going fear happen stop could sleep forever cool wake everyday panicked pain feeling like shit terrified day mental health issue fuck everything make matter worse everyone mental state affect kid partner need better better hurt know fail cannot stop feeling way tried everything medical science offer blessed pcp listens psychiatrist top lastest treatment say everything mean freaking every medical treatment exception est tired want vent else cannot talk partner blame telling thing like made happy would happy fucking heartbreaking love much he supportive patience around amazing human really deserve girl deserve mom pretend enjoy spending time suck suck
2021-05-02 00:58:47,hate way look much cannot right proportion
2019-01-07 13:26:54,planning see doctor tomorrow idea start bit background struggled depression possibly year recently month suicidal sought help gps start conversation never doctor idea expect expected tend conversation head week say know start doctor wanted know experience went
2021-08-08 02:43:04,even know start suffered depression since diagnosed attempted suicide couple time dad thought living mom alleviate symptom stupid think mom always verbally abused one reason hate first place guess burden anyways moved back home country live mom pandemic hit even difficult keep sane throughout situation past month friend one leaving country left chance meeting new people university open yet feel bad fact enjoying life instead lay bed day scroll reddit instagram aimlessly hour ironically start studying psychology wanted help people fucked october care care anything anymore started working month ago thought would help improve mental health see point anymore see old friend country living one home country living life despite pandemic cannot help feel envious live better country fun going party like etc matter stuck rest life making week best scenario possibility improve life quality since good anything point really hope someday courage take life cannot stand anymore
2019-09-18 00:28:16,went doctor day said sick minor heart attack detoxing med feel like shit fast forward day heart attack know read ekg fast forward day later doctor went originally call tell actually fucking pneumonia way latuda detox suck
2022-12-10 21:39:49,know much longer deal life full physical pain loneliness sense never financially stable enough able make first two worth struggling long medication nothing therapy giving breakthrough journaling repetitive unproductive even look world see place worth trying live reason keep going family deal alternative hard pain cannot stop cry even though probably bring migraine feel hopeless anyone want talking want die
2019-10-14 03:11:09,thrown cold depressing water pitch black keep swimming looking happy moment keep afloat meanwhile friend family back boat relaxing keep telling swim back boat difficult keep head water keep cry help none care none going jump freezing water save worth effort start floating back conserve energy stuck water little hope left know going drown eventually give keep floating maybe someone help maybe abandoned keep floating
2022-07-05 00:51:34,month back therapy appointment therapist list thing motivated stay live revolves around annoying catching school work would graduate college next year sometimes terrified idea actually without friend thing like school work keep busy make feel like reason around shallow sometimes even worth like actually nothing really enjoy anymore sometimes think trying new thing staying busy always end somehow making thing worse sure anymore
2021-02-23 02:58:37,told every day need responsible job love pressured leave higher paying one constantly told people like face damnation know hetero told stop playing victim talk mental problem like anxiety depression monitored pestered nonstop overbearing narcissist attention seeking hyper conservative conspiracy theorist fund move genuinely considering leaving know much take constant arguing bickering get redirected mental health failing paranoid judged talked feel guilt anxiety buying something wanted year horrible love hate relationship family make really hard happy lie constantly belief feeling topic want get debate wrong short sighted liberal genuine trauma need talk therapist fund support able sometimes genuinely think would easier end terrified dying taught emotional manipulation would land hell worse life want get away person could talk brother moved away want bother feel lost empty alone afraid sharing problem tried got bible shoved throat told felt way sin ignored problem want help
2021-02-17 07:27:58,thing wake morning fleeting thought run head killing suicidal plan ideation plan way etc thought pattern run head usually wake diagnosed anxiety take benzodiazepine like thought somewhat disturbing anyone else symptom old male high functioning high earning employer employee
2019-10-29 02:56:33,story kid third grade made mistake actually fall love someone relationship left due school transfer grade united via facebook told let u friend left guy okay friend made happy middle school start see girl seems happy friend slowly leaf last year middle school complete stranger last year highschool started last year middle school met online friend felt close bond girl highschool started lose bond felt felt god damn loser laugh talk others keep thing know nothing even though friend god damn piece shit one world give shit friend fake always alone
2022-01-20 16:42:34,feel unmotivated start task get bored quit help
2019-03-26 17:35:56,hate feeling emptiness thing feel keep going anger towards family stuff happening world trying happy understanding le stressed every damn thing even situation happening know control get irritated control know need accept thing let fighting whole life keep thing feel like danger lost freak cause anxiety spike tired want live anymore holding thread sorry making much sense put text brain thinking sorry
2020-02-06 00:13:05,done done feel totally sick pit stomach bye
2021-02-22 10:22:05,everything seems hard boring anything passionates proper goal look forward hard see get school morning happens next get boring job boring thing rest life hardest thing changing mentality hard nihilism seems thing mind wanders nothing seems worth cannot get motivated
2022-09-17 02:17:02,f baby week ago boyfriend ever since baby came distant really help baby feel need help baby receive recently found texting woman week postpartum broke really want self harm scared someone call child service told psychiatrist bpd family doctor think bpd exists prescribe anything feel alone suicidal literally one life willing understand going love baby much hard time seeing end tunnel sometimes believe would better someone else
2020-02-16 23:48:55,give know everyone say one perfect life agree think always feel shit matter always something bring know never get better point trying feel like trying anymore want disappear cannot even remember last time feel like want never come back
2020-04-04 08:47:43,long hatred death driven redundant sounding right think thing keep going sometimes want see human world burn ash witness new era begin whether happen ever let alone lifetime kind slim goal guess goal enough time show feeling create sun dappled forest floor glittering spectacle light shone glossy fern boulder one admired though hart anyways pushing way undergrowth emerged familiar glade squat tree sat middle hart lifted trunk like nose test air grass freshly turned wet earth leaf rodent even another far hart assailed strange beast tested open air danger strode full light afternoon sun trailing twin pronged horn beam flowed bent back harsh angle almost foot middle tine point straight skull fore time curved around nose cloven hoof neatly picked way towards central tree sheer height nearly half foot tree trunk front reaching branch easy bottom already picked clean previous passersby hart lifted trunk slipped serpent like tongue search foliage prize foot foot rough edged tongue kept reaching tasting near finally nearly foot tongue wrapped around sweet apple firmly plucked high perch crunching long awaited treat hart froze lifting nose ear rigid listened recorded surroundings via smell grass freshly turned wet earth leaf rodent far hart slightly closer clay clay snap twang sheering pain hart leaped nearly crashed tree meadow thundered pulsed righting making forest ground shook beast forgone stealth favor safety vision blurred reddened singing bird cacophony confusion ground treeline ever away world stopped moving hart leg crashing forward crumpled heap tried desperately right continue sickening scent iron scent wanted ever experience assailed nostril end fawnhood decade prior mosaic scent like clay flailing head struck hindquarter beam resurging maddened state everything started fade bird buzzing fuzzy blur grass water painting mixed red brown tanned pillar moving closer clay stained face peered hart eye motion stopped went limp
2019-10-03 16:55:35,hard keep together around people maybe sometimes like around people anyway depression bad feeling really upset alopecia condition lost hair hair head eyebrow eyelash pubic etc one single strand extremely intoxifying mental health felt better since day diagnosed suffer thru taken rapidly september full head hair january completely bald head toe seems like nothing worse completely heart broken amount therapy help mg lexapro anxiety depression self conscious low self esteem highly hate yeah also mental problem past became even worse ever possibly could worst thinking dying wish others could understand pain wish could understand mental health
2022-07-14 23:00:45,hey guy first year old depressed since year old first got bullied found atleaft friend every thing else would need happy problem happy may childish see problem others feeling emptyness sitting bed like zero live sometimes think jump window would family friend cannot even find reason like even working really helped last year atm even motivation anymore skipping gym like today maybe anyone problem solved tell talked one friend till really help want talk anyone know family would look weak want care much would accident would fault know sad happened would fault please help
2019-05-29 06:47:40,guess ill start name best place anything name edward turned month diagnosed major depression gone slew medication deciding stop work hide pain anything make feel better altogether name title say cannot seem get anything right life understand lived particularly difficult life compared povertystricken child victim domestic violence etc come major depression worry going bore life story way asking help ampxb longest time problem feeling tough describe best word apathy feeling anything struck teen year still late twenty diagnosed high functioning autisim young age even thing inside feel like ending every day since nothing really make feel better nothing really give incentive keep going energy study school never went anywhere feel tired sleepy time cannot sleep night know sound like contradictory statement say statement apathy feel hate towards could get date till pity date friend point seen one friend already date girlfriend girl talked point trying make lucky love hard date someone feel nothing hate several suicide attempt belt ampxb year later taken advantage many people without care led nothing hope hope death often imagine jumping front bus downing dangerous chemical work parent see still acting finally went doctor behold test result reflect feel lack thereof parent ignore friend anyone mention especially friend ask ignore think moody lying emotion learned look like emotion year helped look normal help case point feel therapy would anything waste time ampxb want feel something turn anyone say easy know talking food taste like nothing feel interest sex allconsuming emptiness girl ask sense somehow ask turn common answer something wrong decided cannot get resolved year going end finally point going like make sure organ much put good use death cannot longer ampxb also post reddit get taken understand part bad luck life cannot even ask help talk problem place made discussing depression
2019-04-03 14:20:53,depression get best read lot read today almost hour counting cannot almost open eye break eating bathing saving grace reading usually keep pain feel word need read cannot describe pain coz know avoiding keep going keep sane always balance even know ticking bomb really want end stay planet fear hurt undone soul damned waiting natural death waste year enduring simply quit second life saved accident kill meaning still need something know need stay feel
2019-07-17 17:08:16,past several year tried therapy still tm probably around different medication recently psychiatrist prescribed medication dementia really run option horrible reaction many med process going extremely exhausting discouraging told ect college student future depends well brain work thinking trying ketamine upon research discovered really work short term also terrible side effect long term effect known studied much yes know typical depression feeling feel really done like nothing left necessarily brink suicide much want stop trying even therapist said think cured modern medicine currently scared ill never get better maybe stop trying med focus managing life better know help actively trying treatment make better seems like cue give completely also concerned fall semester like last year missed two large chunk school due mental hospital thus making already stressful semester hellish feel totally lost point advice would appreciated
2019-01-03 18:29:48,know sound like anxiety depression honestly cannot even tell depressed anymore something else entirely anyways still christmas holiday school promised first day december finally organize paper place study place absolutely organization needed study many subject cannot understand scientific stuff work two presentation many book wantedneeded read practise foreign language skill fast forward two week exactly still situation barely anything today trying organize anxiety attack realising much still cannot tell depression possible add plain laziness indiscipline relatively motivated soon start something stop either work going well realize much got get discouraged equally important feel like wasting time cannot concentrate finishing task brain feel dead like exploding seriously cannot understand math stop overwhelmed solution give phone watch youtube video get tired hell even tried watch educational video math science much interested subject get thing happens tried language learning instead super easy always get distracted like justtune last resort tried educational video nothing school still justified least learning something still work anyways mess need get shit together help sorry appropriate sub legit thing associate problem
2020-02-16 04:31:41,sometimes afraid everyone feel way feel particularly bad dealing know lot people also significant struggle mental health maybe people tend associate seems normal cannot imagine people know feel like want normal though everyone feel way bad dealing make embarrassed talk stigma misunderstanding ashamed handled ashamed bad depression normal even illness issue would like think sometimes completely debilitating depression illness would like think thing done harm illness want believe fault
2020-01-26 02:05:31,look forward weekend week mean work realize absolutely nothing left device friend hobby nothing saturday walking around house laying bed phone opening fridge taking nap waking feeling like hour gone minute feel empty crazy like want simultaneously cry yell ill think place store market literally anywhere feel unmotivated ill think point else thanks socialgeneral anxiety feel awful around people self conscious fact alone end day exhausted exhausted even though done anything day cannot drive productive ill end night excited bed disappointed knowing nothing dreading fact ill continue day like
2020-07-03 08:31:49,inki clinically depressed probably since childhood therapy year taking medication problem motivation anything mostly watching medication like talk today medication reuptake inhibitor meaning hinder decomposition certain neurotransmitter much layman term cannot create neurotransmitter mean something create first place stay active much longer time compared without medication since realized force really easy task directly wake make bed laundry last night bin etc helped lot sorry maybe obvious least one person find helpful good job thanks stay strong inki
2021-04-23 01:21:11,remember last time genuinely happy wish could sober happy weed fix short
2021-12-09 01:41:30,every decent thing normal person would want decent family grade friend full hate point would want destroy everything accomplished ruin life feel something sometimes want fuck everything people would notice
2019-10-10 12:29:33,know much longer every day ignoring voice telling hurt trying wear body sleep sometimes work time spend night staring always grinding sadness waiting really tired want wake anymore
2020-05-14 19:00:57,thinking calling really bad place right suicidal thought bad also know expect calling scared call case someone else need anyone give information like
2020-06-23 15:57:55,title say really know anymore awhile felt like even depressed depressed still smile really good time happy friend family feel way people lot term supportive people life everyday feel like waiting something happen something change overthink constantly binge anything make feel better become lost guess porn addiction started make feel good temporarily think past time made mistake want change make better pressure put wrong person get even make minor mistake dwell feel like deserve happy love feel like losing friend isolate thing anymore one person always talk cousin he declining call recently saying hell call back never fuck guess matter anymore thought ending something inside scream fight maybe thought better future actually happy like used maybe thought friend still close know want get rid feeling feel like nobody help want outplease
2020-01-02 16:00:55,diagnosed depression year ago mental hospital several time tried various type medication also counseling fairly recently talked nauseam thing need improve condition exercise better diet going outside socializing people usual stuff profound understanding need get better cannot bring adhere idea wondering incredibly lazy instead depressed poor state mind stem inaction reclusion
2021-06-25 16:40:48,loved drawing school got university many shiny thing kind drifted apart trying get back drawing improve skill like anatomy study work fine come anything creative stumped creative drawing seems like huge insurmountable mountain thing consider decision make god forbid slip something come like hoped want enjoy drawing especially creative head hurt thinking
2020-08-08 23:32:29,closer get think maybe get another year max left live time change still think stupid stuff continues ill year old nothing done completed life like give make goal make plan take sickness like covid wipe make everything worked towards useless like fuck
2020-02-24 07:32:20,mother law bought ticket home see family husband mentioned feeling “down” lately think may wanted help know suffer depression recently lost daughter suicide honestly happy see family really feel empty still always feel empty happy short burst cannot manage maintain feel guilty since mother law bought trip “cheer up” feel better started feel like wasting everyone time worth effort help whole time away insecure mess husband away come far self esteem issue apart really struggle ugh vent thanks anyone read know tell
2021-04-21 16:49:22,brother life state good couple day ago brother said really transphobic shit discord grandma live keep saying transphobic shit making really fuking sad always depression past week total fucking mess family making sad get sad rando say transphobic shit really hard deal shit every fucking day
2020-04-16 22:42:04,feel like cannot happy friend right hate recent new kind person cannot happy joy life people care age friend getting house getting married starting family ready thing want life much ala everytime hear engagement pregnancy announcement want burst tear never thought would person hate right hard talk anyone finding hard feel genuinely happy friend happy feel like getting left behind also feel like worst person world know compare others cannot help know age number female fertile year limited also feel totally selfish whining middle global pandemic actual fuck wrong cry write feel totally utterly pathetic serious thing worry honestly cannot seem hold tide emotion right hating making even worse sending vicious cycle anyone else ever felt like whether reason different would welcome thought experience even knowing alone would everything
2019-09-07 16:28:04,horrible cycle year past year particular nearly impossible start work monday think finishing friday back soon house sat mind start running marathon nothing brings sort joy lose focus watching really play game capable learning instrument hobby currently sat home saving money holiday even want fucking got choice hour would honestly rather work least mind working time pass quickly used love weekend trying stay awake long could try sleep early possible cannot wait sunday gone need something otherwise life really point suicidal thought increasing worrying rate edit could clearer regard feeling depressed since earliest memory always felt like lately getting worse worse thought thing would change left school thought moved got girlfriend got new job moving completely new city new year still feel like uprooting life think suicide likely think ball surely much one person take
2020-09-20 07:07:17,rough lately feeling pressure real world internal issue yet resolved also feeling norm however quickly reminded love around feel good moment despite underlying sadness overwhelming anxiety hopefully everyone understands loved someone importance world okay please let emotion try pick though human emotion come whether happy sad anyway good night message need talk want new friend
