created_utc,text
2022-09-11 05:02:46,parent always year old came america another country well best mom chocked close death maybe learned really sexual thing someone building copied sister know fucked sorry scared cry guy one belief idea sex mother found told father explained explained happened one belief guy getting life check father cannot even look eye one belief getting suicidal thought daily calling rubbish garbage find every way scream best try please want run away please fucking tired excuse language want happy forget life smile goddamit please someone help know young know time time cannot heal wound know much time till end
2020-02-18 02:46:35,lovely beautiful smile always make happy also suffers depression quite outlet person make feel better love much want lose person really get tiring offer hobby thing meditation anything therapy refuse want lost shall stay listen slowly degrades help
2022-06-17 13:46:29,someone touch inappropriately specially without consent
2022-03-17 18:01:50,earlier today said said fine
2022-09-22 19:48:05,feel like purpose nothing live motivated drag thing every fiber anyone tip handle would open
2019-10-03 10:25:41,suck undoubtedly single worst person world inherently solitary human mean supposed socialize attraction society incapable moreover evil thought suicidal thought competing nothing else like either live make trouble people life kill best outcome everyone since know morally inappropriate hurt harder harder time go utter confusion disatifaction discomfort playing video game free time anything meaningless supposed would anyone actually say die worry also appreciate would help anyone would least say yousomeone worse position
2022-08-17 08:05:30,partner interest common see future never seen one wish death every day constantly fighting never look forward relationship fight push depression though sure would miserable anyway tried couple therapy think need help want really want divorce wait year old live abroad temporarily come different country split clear way child unless continue living abroad know want maybe cannot afford live apart either neat future imagine happy either stay shit marriage kid divorce maybe fuck life probably around since able live country everyday past year thought killing wishing dead tell “you piece shit monster” every day never occurred maybe everyone think way recently is…a rant guess
2020-11-28 21:52:41,worst part depression restless boredom restlessness make want rip hair boredom cannot fixed anything sit amp feel like shit nothing feel good anymore
2019-02-09 22:49:53,reason upset everything right weird state every little tonal shift every little thing upsetting boyfriend’s message getting repetitive short lost interest friend busy secretly like small noise clinking hate emotional today like everything feeling like large swing emotion
2021-03-07 04:22:48,everyone life like mine full false start broken hope yet somehow find point life turn month point life sole reason exist take time money resource
2021-05-31 12:20:14,familymy parent older sibling always tell cocky person like keep around people somewhat introverted enjoy around people interacting feel depression caused completely closed people whether closed well apathetic assume interpret type behaviour hostile mean way used enjoy around people talking feel exhausting ever try explain feel approach made worse really hurt see wayi would really like see change
2020-03-10 04:35:45,sometimes feel like like everyone else’s thing cannot say anything else weird feel frustrated sad
2019-08-14 04:26:05,went pill year ago really desire back somewhat stigma know well hate seem affect finally caved family constant talk asking back went doctor put lexapro fine started thinking self harm almost stopped feel anxious hopeless experiencing crippling amount brain fog leaf feeling control frantic want stop taking everyone say much better keep taking ill settle everyone still think outside reflects inside depression stigma still around canshould wandering soul
2020-01-01 10:34:19,happy new year cannot wait end cannot sleep anymore everything suck feel empty inside time therapy help
2020-04-29 22:08:15,ever since broke month ago dick stopped working really annoying tried hook girl since super hot like brain wanted bad body reacting annoying anyone experience help imagine treating depression may reverse supplement take may help
2019-07-25 22:18:39,last month really hard depression could deal month ago mother diagnosed lung cancer died month still living father two gear grinding since mother gone taught suicide lot one friend live life across atlantic sometimes disappears multiple day worst day father know everytime showed something outward said toughen year old meaning could psychiatrist alone father would know
2020-10-29 06:50:39,suffering depressionlike symptom know need therapy scared tell parent worried interrogate try understand given much grateful cannot tell worried think insincere hardly tell anything life thought ask give glossy anecdote briefly touch day cannot tell really going want worry feel like trapped inside box way hole opening inside ground ready swallow overreacting
2021-05-17 18:39:41,cleaning room found birthday card inside desk practically best year life closest friend first time ever got birthday card aggressively pushing away close friend quarantined parent lowest point life try reach back friend wait college hope life get better
2019-12-01 20:06:03,know depressed cannot sleep night sleep least hour room cluttered mess dropped college second time interest anything cannot seem happy anything lay bed day get work lack motivation badly today spent good portion morning looking thing google like “how happy” “how motivate yourself” “depression tests” mention mom family member want see get diagnosis say “there way depressed” came maybe see others problem want learn happy everyone life around something feel like disappointment family friend
2019-05-28 01:03:42,work never good enough always inferior others one ever truly understand idea absurd antiquated lack originality deserve pain hardship weak even change nothing change father disappointed better leaving home staying gone long time destined die alone weak overcome addiction graduate college nothing life nothing never experience happiness died infant anger undoing avoid happiness always temporary weak wanting loved accepted
2022-04-29 09:25:24,amp female wanting coz read writing feeling help cannot say finally got around doin depressed yr actaually life pretty much sucked since lil kid realised yr ago much say know say idc people read want let hoping help please report smth reasonsill probably curse lot ill start family child parent fight lot dad shitty dad even worse husband mum mean well one life literally keep leash allowed leave house unless one parent perfectionist ironic yell lot st dint matter recently even littlest mean thing say make want cry speaking cry keep sometimes cry bathroom sometimes hurt stopped mum saw asked tolf feel playing footballi play football obviously many friend since even allowed outta house without mumor dad po like frnds pretty close still cannot tell life know parent fight put image perfect family evryone see people think leave house bcoz introverted introverted like well though ampxb lot say know say ill stop wanted write smth coz getting real bad see everyone else age nice life like bad pray fro death every single night bye thanks reading
2021-07-11 20:00:15,depressed cannot move body feel weak exhausted time cannot stop cry everything hurt bad hate person depression made stop taking caring much feel fuckin ugly used feel little pretty hate even look hate moving body hurt head hurt want fall back asleep feel like nearly everyday know stop nothing alone
2022-07-09 18:19:45,cannot seem focus task hand thing cerebrally understand good instead waste away time youtube porn waste life messaging girl tinder cannot believe year existence lead moment thought would happier quit job given much free time see filthy hedonist keep relishing pleasure chance get every moment seems pursuit sort pleasure make feel good make feel better previous moment want friend someone life interact feel like dislike burdened developed blank eye dog intellect bright idea nothing left school people used regard smart promising idea simple household chore seems unbearable worst part therapy cannot honest therapist feel like would burden well problem remember grade school freshman year specific bus ride lived way missouri countryside bus route always long one happened first one picked due length ride get early typically around meant ride lasted hour hour half long bus ride always gave plenty time think life general esoteric concept specific bus ride thinking thoughtfeeling running unbridled unconditional love people humanity consequently big fat goofy grin planted face whole day managed maintain mindset month later really started initially fall think depression really began started see short fallings humanity silly little ape thought idea inability horrible thing done seem everyday started generalize people culture make offensive joke care fell depth nihilism attempting view everything objective lens believed true created framework bashed humanity extension sometime later began experimenting lsd trip convinced antichrist alarming part trip coming realizing fact viewing life skewed lens hyperactive version sober lens still convinced capacity fit archetype school shooter difference one actually turn way happened good looking enough popular enough picked get girlfriend would naturally emotionally abuse think evil doubt mind going hell exists really doubt though case foresee heaven hell scenario god became utterly disgusted humanity developed packed bag left rot destroy would blame known happiness known love known whole range human emotion none whole controlling current mindset dominates honestly amazing able seamlessly let fingertip chatter away keyboard translate thought emotion suspiciously well english language feel like hole live deeper get know would reset suicide selfish erasing identity would difficult reinventing seems path forward think feel sometimes think insatiable summer burning within depth winter
2022-12-22 00:31:35,lately bad breakup falling two best friend unshakable feeling loneliness worthlessness bluntness interested anything problem since always copped loneliness thought however worthlessness new could really understand felt like bluntness made everything worse none past habit fun video game sketching programming assignment university since forced blue moon whenever friend asks never initiate forced exercise least week completely lost appetite losing kilo force eat well force keep university finish point force stay computer mindlessly searching hope finding something even know something tldr would state lost interest everything used enjoy desperate find something interesting exciting fun life depression simply sad
2021-08-02 02:55:29,year one misfortune every day feel weakened due neuropathy constantly hoping wake fine feel better time go seems dream try ignore comfortable life cannot cannot sleep well cannot lie cannot rest could back time able enjoy body every day one endure longer care thing well pretend every damn second cannot stop thinking hurt feel drowned suffocated problem want cry feel weak want burden honestly cannot even listen music liked reminds time happy healthy body feel like going live long think take anymore could rest feel good time rest stop scratching thinking lack blood know well nerve damage never away night made desperation stretch stretch thinking fix tried everything cannot get better feel like living nightmare nightmare hand leg slowly rot want live comfortable life without pain gone doctor doctor avail spiraling sadness hatred towards want end want like anymore want wake feeling like every part body fire
2020-10-30 03:46:47,feel normal life never really friend acquaintance never dated much le never went bar club twenty spent much time nerdy pastime wasted much time handful minimum wage job throughout twenty got shit together nervous breakdown late twenty became nurse year killing find lasting friendship job lost connection people seemed want friend always felt different bullied elementary ignored middle high school terrible existence please tell one
2022-02-05 21:29:45,girl passed away september sudden unexpected came home found dead living room cannot stop thinking supposed time together upset taken away time needed think ever get cry time atleast day suck much
2021-01-03 04:22:10,want think want auto pilot cannot want able watch youtube video movie show without thinking life death want think want forget everything cannot wish oblivious everything
2019-07-20 08:47:47,year old done fucking nothing complacent allowed mental illness drag pathetic low barely even consider human let alone functional adult fucking hate hate seeing people well hate seeing people went school struggle suffer people get wake career goal joy even get energy wake every day feeling useless day give everything want drive motivation fucking hate want fucking die fuck
2020-03-09 10:24:38,never actively used reddit first post first account wanted get started lately bad wave depression hit needed somewhere could get people view feel comfortable telling friend family one going long one lot random information try give reader better understanding going hopefully someone went soemthing similar came better go name dan semirural town australia finished school end since spent month failed apprenticeship month working casually aviation job interest sport particularly soccer cricket movie history gaming depression numerous time life rarely point long lasting multiple week daily depression effecting daily life long lasting depressive episode one discus first long lasting episode age mostly worry better single never dated anyone close friend failing school intelligent enough pas previous passion used interest longer next episode age final year schooling still failing grade know wanted end school getting pressured parent career path want lastly still single huge confidence crush girl liked led month humiliate near end way mostly fit time rocking six pack gut either lack confidence self diagosed social anxiety physically better worse average person jsut turned next much bigger episode happened got fired apprenticeship basically put effort hated still single save time time writing still single lmao move away friend apprenticeship well overall lost know main event basically feel terrified living best life know full extent feeel like sort career path university something like feel like past feeling much pressure social environment talking girl never co said terrified haha finally feel demoralised stuck pit cannot get feel like written roughly please ask info area comment help keyboard fked anyway made far thanks reading please ask away
2020-04-11 01:15:39,basically started seeing world differently around one worst year life would cry bed hour every day would starve passed way self harming thought maybe unhappy mean lived small as city brazil home country went school hated hated class teacher classmate relationship parent also best miserable make sense everything changed college majoring passion surrounded people love care amazing friend amazing partner relationship parent family thousand time better relationship kind gone downhill came lgbt accept still fucking miserable still feel amount sadness anxiety loneliness used feel make think maybe really situation tried therapist nothing work family communicative kid would never really share open parent feel like cannot open know therapy talked everyday life never mentioned depressing anxious suicidal thought therapist even thought completely healthy dating someone communicative everytime sad want talk help cannot feel like knot throat prevents talking kind stuff fucking hard weird though sometimes feel like top world think decided move united state studied hard got college house came hour flight carrying shit suitcase plus fucking great school get straight proud really like fuck know everyone thing proud learned japanese fluent set goal moving new york even though friend tell look inspiring hard worker feel like nothing hurt others feel like deserve die wish everyone would forget existence love reading philosophy sociology book religious think world born die eventually everyone knew also die forgotten unless stupid famous changed world nobody world remember existence whatever fuck want nothing matter sometimes thought brings peace make think grateful thing like sometimes thought brings nothing despair want remembered feeling low head like nothing matter killed yet stop pain course one day feel like top world deserve good thing one second later cry corner wishing death sometimes shift mood happens nowhere happens sometimes hanging friend hit spend time trying console trying make feel better make feel fucking awful everyone life would better make big plan starting sell art opening online store next day want hear plan even le follow sometimes feel like completely different people inside confusing feeling know young cannot imagine happy even though happiness state mind need sadness able feel happiness cannot imagine living good stable life cannot open fear paranoia bottled feeling never able open anyone maybe never maybe feeling forever fucking sad want selfdiagnose maybe depression way fucking worse feeling selfdiagnose depressed person maybe disrespectful actually head sad person escaping ill sad person forever depressed
2022-05-08 12:17:38,recently moved europe country finished bachelor degree year depressed wishing could die every day matter fact attempted suicide twice somehow end hospital dead anyway tried happy everything person feel ounce happiness life eventually met guy loved made accept homosexual guy month met leave country residency could find job god know hard tried stay iam back country miserable depressed want die genuinely want anything life anymore iam tired want suffering end
2022-06-04 05:24:23,today plan make hard decision life yet plan fucking coronado decided put normally would pissed time fucking furious action plan going call therapist talk instead chula vista decided surround house haul handcuff jolla mention second cop saw black pound frame placed hand gun yeah happened still handcuff hour later asked suicidal said asked planned hurting said nurse looked perplexed asked kindly said ask bitch admitted social worker came asked history said sure mind bringing trauma help proceeded tell ptsd sexual trauma suicide attempt recent lay job unpleasant face nurse seemed saddened begrudgingly reminded need care care remember happening contact therapist right hour spoke therapist gently told okay hard thing spoke wife mention wife burden handle pill bill kid part life mental health cannot handle spoke released like nothing happened thing told okay first place guess multiple thing white coronado want someone messing holiday traffic used training copa handcuff nigga general test dummy nonetheless released problem honestly hope read want askwhere safe space talk dying pain anguish deal without dragged hospital like fuxking mule thanks listening
2021-09-28 08:09:28,say feel like know one care listen money listening none understanding pain real yet without evidence feel tear even laugh feel unloved maybe always going unloved yet see affection know worth tear real laugh feel controlled yet know remote control feel tear verge making bawl fortunately feel happy sometimes laugh aloud feel king world yet moment change cry cry hour tear dry second like never cried dumped self guilt cheated everyone around think never loved anyone feel cheat maybe threat day cry tell people hope ill feel relieved yet remains
2020-01-05 01:08:05,wish could make people life give shit fighting hardest depression dealt year old life everyone absorbed life bothering ask something try help lucky get minute someone time every six week try something desperately want people want thing like want always excuse people cannot thing sick sick people ask thing favor always nothing return keep thinking would take people give time day sometimes try hint people need spend time tell something meet new people bumble meet someone work way want hang talk stranger setting shy around new people idea fun know anymore besides continue wallow thought rabbit hole hell already
2019-12-29 20:35:23,want talk therapist issue know scared
2019-12-01 00:51:04,know nobody care guess leave something somewhere incase people duh happennedede decide finally fucking know anymore let preface better two year ago made post yet probably kill know anymore depth self loathing people look weird anymore know mostly stumbling around wasting youth wondering one person life put amazing knowing nothing matter never matter want script writer want musician want bullshit thing ill never true year could done something got bullied trying school everyone family friend school faculty either hated told realistic life goal wasted sulking took whatever job would put could barely scrape nothing look forward ill never amount anything scared everyday one person still belief wise leave like everyone else everyone else know much disappointment always look even force part something want thanksgiving fucking mistake never making rest year next year rest life nothing absolutely nothing think want kill anymore pin line point everyone guess
2022-08-27 04:48:20,throw away account want anyone find real life tired dude tired living working making mistake tired someone always telling find lesson something tired smile never quite reaching eye tired feeling like going somewhere scream sad depressed time nothing effect anymore numb know love anymore friend friend would even want friend going every day motion breathing suck hate hate earth hate know never kill quite frankly death terrifies wish exist hardest thing world existing cannot day day anymore day running together weird blur nothingness feel like body trapped void nothing make happy anymore keep fucking god world easy enough let feel alone sad even though friend family cannot help feel like belong would hate knew run head want happy know last time cannot remember feeling cannot even cry feel nothing feel like tumor earth cancer belong know even begin getting better know mental energy try
2022-09-12 05:06:50,regularly gone therapy almost year tried taking medication awhile made made feel worse quit drinking morning without pain force sosial day know depression get worse lock away know night get home start getting ready bed mind start spiral every singel action take day mind decides replay commentary commentary pure intrusive thought know anymore really starting feel hopeless would love advise
2021-06-21 19:35:48,barely eat anymore interested hobby isolate family barely leave bed therapy helping therapist new course wanted hear life story work every bit trauma done already two therapist thing sometimes keep going medication mg citalopram day nothing want thing end already much pressure empty inside painful every day feel like year every night cry wake least time always tired always empty want keep going anymore
2019-06-18 01:02:47,know might better lot people already think pathetic strength deal issue cannot seem get right period life country country going shit right tip record longest time without government government better one fuck getting expensive household much spare anymore shot love later life verge dissapearing smart enough brain keep procrastinating country cannot shit without degree relationship hanging thread barely love anymore unable support emotionally even though really want stupid even want move far away know hair falling nw keep balding raster yay cannot beat masturbation addiction wrecking shoulder making impossible build one thing could reliably proud body brain fog get better wellbutrin take slightly help get anxiety high libido see side higher dos improbable cannot really find emotional support parent since cold term anyone except want bother constantly best friend childhood becoming alcoholic drinking till smashed multiple time week cannot connectie anymore feel fucked fetish everytime try fix thing fail everyone peer group except anger problem keep worsening list go know anymore guy know could first step therapy help anymore since forget much med already
2022-09-16 19:23:21,video game binge listening weeknd snack unlimited diet soda anything give dopamine shot otherwise might feel suicidal lol
2020-02-08 14:04:53,gone day close food one chip cracker cheese half chicken schnitzel anorexic least consciously trying yes selfconscious weight would never starve wanted eat probably thinking day cannot bad know people longer food still horrible feel like going pas feel lightheaded stomach killing still want eat want feel like agh fuck wrong let eat bit midnight stressing scared going pas today day would able sleep even tried stomach hurt bad fuck
2020-06-28 11:15:26,last year felt increasingly brain dead even unintelligent cannot remember word cannot seem form coherent normal sounding sentence feel stupid fucking time feel like brainpower normal year old would alongside good old mentally impaired brain juice forget thing general hard time concentrating even know fix want feel dumb anymore
